{
  "schema": "org.luminousdynamics.nixward.deployment-transaction-benchmark-corpus",
  "version": 1,
  "status": "proposed-not-executed",
  "baseline_registry": [
    {
      "id": "nixos-rebuild",
      "status": "available-baseline",
      "role": "native-local-build-and-activation",
      "notes": "Run build, test, switch, and boot as distinct operation modes. Do not collapse their semantics."
    },
    {
      "id": "colmena",
      "status": "available-baseline",
      "role": "fleet-scheduler",
      "notes": "Run single-node correctness first; measure fleet concurrency separately at 1, 5, and 10."
    },
    {
      "id": "deploy-rs",
      "status": "available-baseline",
      "role": "remote-multi-profile-deployment",
      "notes": "Record autoRollback and magicRollback settings; include post-activation connectivity confirmation."
    },
    {
      "id": "nixward-direct",
      "status": "available-baseline",
      "role": "existing-direct-spawn-transaction-path",
      "notes": "Pin exact source SHA and journal/receipt schema."
    },
    {
      "id": "nixward-systemd-gated",
      "status": "gated-not-yet-qualified",
      "role": "future-systemd-supervised-transaction-path",
      "notes": "Do not run or score until authority, persistence, and disposable-VM gates pass."
    },
    {
      "id": "sqlite-admission",
      "status": "prototype-only",
      "role": "admission-storage-microbenchmark",
      "notes": "Temporary-database prototype only; do not treat it as privileged production storage."
    }
  ],
  "global_safety_invariants": [
    "false_terminal_success_count == 0",
    "duplicate_mutation_for_unresolved_attempt_count == 0",
    "unauthorized_or_replayed_admission_count == 0",
    "foreign_transaction_attempt_worker_or_invocation_acceptance_count == 0",
    "payload_release_before_durable_admission_and_worker_identity_count == 0",
    "successful_terminal_dispositions_have_complete_evidence_chain == 100_percent",
    "safe_hold_is_not_counted_as_successful_recovery"
  ],
  "trial_evidence_fields": [
    "nixward_commit_sha",
    "benchmark_harness_sha",
    "scenario_corpus_sha256",
    "nixpkgs_revision_and_flake_lock_sha256",
    "candidate_closure_store_path_and_digest",
    "vm_image_digest",
    "kernel_version",
    "systemd_version",
    "sqlite_version_and_compile_options",
    "filesystem_mount_options_and_storage_cache_policy",
    "transaction_id_attempt_id_plan_digest_machine_binding_digest",
    "replay_key_digest_permit_digest",
    "systemd_unit_job_id_invocation_id_when_applicable",
    "worker_pidfd_identity_and_process_start_tuple_when_applicable",
    "fault_seed_and_exact_injection_boundary",
    "monotonic_phase_timestamps",
    "manager_events_journal_snapshots_process_receipts",
    "independent_runtime_and_profile_observations",
    "stdout_stderr_exit_status_and_artifact_digests",
    "raw_trial_record_digest_and_terminal_classification"
  ],
  "comparison_rules": [
    "Pin identical Nixpkgs revision, flake lock, closure, VM image, kernel, systemd, cache and network conditions for matched trials.",
    "Compare nixos-rebuild switch, test and boot as separate semantic operation modes.",
    "Do not treat Colmena fleet concurrency as a single-host activation latency baseline.",
    "Record deploy-rs autoRollback and magicRollback settings; do not disable normal rollback for convenience.",
    "Only run nixward-systemd-gated after authority, store, and disposable-VM qualification; it is not an available baseline yet.",
    "Never infer exactly-once execution from a local journal; use at-most-once submission per unresolved attempt and reconciliation."
  ],
  "scenarios": [
    {
      "id": "noop-admission",
      "category": "functional",
      "comparison_group": "admission-overhead",
      "operation_mode": "admission-only",
      "supported_baselines": [
        "nixward-direct",
        "sqlite-admission"
      ],
      "preconditions": [
        "Disposable host is at pinned pre-state.",
        "Approval/intent is valid but operation has no host mutation.",
        "The same request identity is used across all retry trials."
      ],
      "fault_injection": null,
      "required_observations": [
        "Admission commit identity",
        "Four-record joined read-back",
        "No systemd submission",
        "No host state change"
      ],
      "expected_disposition": "validated_no_mutation",
      "forbidden_claims": [
        "A command exit code alone proves the intended host state.",
        "Missing manager reply, signal, or receipt proves that no mutation occurred.",
        "A safe hold is a successful recovery.",
        "A queued workflow or unverified future systemd path is a passing baseline."
      ],
      "metric_tags": [
        "admission_commit",
        "readback",
        "control_plane_overhead"
      ],
      "min_trials": 30,
      "trial_class": "clean-baseline"
    },
    {
      "id": "service-configuration-switch",
      "category": "functional",
      "comparison_group": "local-switch",
      "operation_mode": "nixos-switch",
      "supported_baselines": [
        "nixos-rebuild",
        "colmena",
        "deploy-rs",
        "nixward-direct",
        "nixward-systemd-gated"
      ],
      "preconditions": [
        "Identical prebuilt closure and Nixpkgs revision are pinned.",
        "Disposable VM has a known current profile and runtime.",
        "Exact plan, approval, service change, and postconditions are recorded."
      ],
      "fault_injection": null,
      "required_observations": [
        "Selected system profile",
        "Running system closure",
        "Expected service unit state",
        "Worker receipt if Nixward is used",
        "Fresh post-state"
      ],
      "expected_disposition": "validated_terminal_success",
      "forbidden_claims": [
        "A command exit code alone proves the intended host state.",
        "Missing manager reply, signal, or receipt proves that no mutation occurred.",
        "A safe hold is a successful recovery.",
        "A queued workflow or unverified future systemd path is a passing baseline."
      ],
      "metric_tags": [
        "build",
        "copy",
        "activation",
        "control_plane",
        "post_state"
      ],
      "min_trials": 30,
      "trial_class": "clean-baseline"
    },
    {
      "id": "test-does-not-change-boot-default",
      "category": "functional",
      "comparison_group": "local-test",
      "operation_mode": "nixos-test",
      "supported_baselines": [
        "nixos-rebuild",
        "nixward-direct"
      ],
      "preconditions": [
        "Predecessor boot default profile is independently recorded.",
        "Candidate closure is prebuilt and pinned.",
        "The operation is explicitly test, not switch."
      ],
      "fault_injection": null,
      "required_observations": [
        "Candidate runtime active",
        "Boot default remains predecessor",
        "Running/selected profile distinction"
      ],
      "expected_disposition": "validated_terminal_success",
      "forbidden_claims": [
        "A command exit code alone proves the intended host state.",
        "Missing manager reply, signal, or receipt proves that no mutation occurred.",
        "A safe hold is a successful recovery.",
        "A queued workflow or unverified future systemd path is a passing baseline."
      ],
      "metric_tags": [
        "activation",
        "boot_profile_invariant",
        "post_state"
      ],
      "min_trials": 30,
      "trial_class": "clean-baseline"
    },
    {
      "id": "boot-only-does-not-activate",
      "category": "functional",
      "comparison_group": "local-boot",
      "operation_mode": "nixos-boot",
      "supported_baselines": [
        "nixos-rebuild"
      ],
      "preconditions": [
        "Predecessor runtime and boot default are independently recorded.",
        "Candidate closure is prebuilt and pinned.",
        "The operation is explicitly boot, not switch."
      ],
      "fault_injection": null,
      "required_observations": [
        "Candidate boot profile selected",
        "Running closure remains predecessor",
        "No service activation inferred"
      ],
      "expected_disposition": "validated_terminal_success",
      "forbidden_claims": [
        "A command exit code alone proves the intended host state.",
        "Missing manager reply, signal, or receipt proves that no mutation occurred.",
        "A safe hold is a successful recovery.",
        "A queued workflow or unverified future systemd path is a passing baseline."
      ],
      "metric_tags": [
        "profile_selection",
        "boot_profile_invariant",
        "post_state"
      ],
      "min_trials": 30,
      "trial_class": "clean-baseline"
    },
    {
      "id": "successful-exact-closure-activation",
      "category": "functional",
      "comparison_group": "local-activation",
      "operation_mode": "nixos-switch",
      "supported_baselines": [
        "nixos-rebuild",
        "colmena",
        "deploy-rs",
        "nixward-direct",
        "nixward-systemd-gated"
      ],
      "preconditions": [
        "Exact candidate closure, profile transition, and action are pinned.",
        "Candidate and predecessor postconditions are unambiguous.",
        "Build/copy phase is separated from activation timing."
      ],
      "fault_injection": null,
      "required_observations": [
        "Exact profile transition",
        "Exact worker/job identity where applicable",
        "Process receipt",
        "Fresh runtime/profile post-state",
        "Terminal disposition"
      ],
      "expected_disposition": "validated_terminal_success",
      "forbidden_claims": [
        "A command exit code alone proves the intended host state.",
        "Missing manager reply, signal, or receipt proves that no mutation occurred.",
        "A safe hold is a successful recovery.",